{
  "schemaVersion": 1,
  "id": "builtin.deepblue",
  "name": "DeepBlue · 日常",
  "version": "1.3.8",
  "avatarId": "deepblue-chibi-v1",
  "description": "原图 Live2D 正面角色、十二种站立表情、侧视步行、盖被睡眠，共 31 个动作组，含 11 种玩手机表情。",
  "motions": [
    "motions/wave.json",
    "motions/sway.json",
    "motions/look.json",
    "motions/hop.json",
    "motions/shy.json",
    "motions/shake.json",
    "motions/sleep.json",
    "motions/walk_right.json",
    "motions/walk_left.json",
    "motions/pat.json",
    "motions/boop.json",
    "motions/settle.json",
    "motions/frame_magic.json",
    "motions/confused_tilt.json",
    "motions/sad_pout.json",
    "motions/smug_pose.json",
    "motions/unimpressed_pause.json",
    "motions/playful_wink.json",
    "motions/cover_face.json",
    "motions/curtsy_sway.json",
    "motions/play_phone.json",
    "motions/play_phone_angry.json",
    "motions/play_phone_smile.json",
    "motions/play_phone_shy.json",
    "motions/play_phone_super_shy.json",
    "motions/play_phone_sleep.json",
    "motions/play_phone_surprised.json",
    "motions/play_phone_confused.json",
    "motions/play_phone_sad.json",
    "motions/play_phone_smug.json",
    "motions/play_phone_unimpressed.json"
  ],
  "groups": [
    "groups/idle_sway.json",
    "groups/look_around.json",
    "groups/greet_wave.json",
    "groups/happy_hop.json",
    "groups/shy_pose.json",
    "groups/annoyed_shake.json",
    "groups/sleep_short.json",
    "groups/walk_left.json",
    "groups/walk_right.json",
    "groups/head_touch.json",
    "groups/body_touch.json",
    "groups/drag_release.json",
    "groups/water_magic.json",
    "groups/confused_tilt.json",
    "groups/sad_pout.json",
    "groups/smug_pose.json",
    "groups/unimpressed_pause.json",
    "groups/playful_wink.json",
    "groups/super_shy.json",
    "groups/curtsy_sway.json",
    "groups/play_phone.json",
    "groups/play_phone_angry.json",
    "groups/play_phone_smile.json",
    "groups/play_phone_shy.json",
    "groups/play_phone_super_shy.json",
    "groups/play_phone_sleep.json",
    "groups/play_phone_surprised.json",
    "groups/play_phone_confused.json",
    "groups/play_phone_sad.json",
    "groups/play_phone_smug.json",
    "groups/play_phone_unimpressed.json"
  ]
}
